{
  "$schema": "./approval-manifest.schema.json",
  "schemaVersion": 1,
  "manifestId": "sskem-publication-approvals",
  "updatedOn": "2026-10-01",
  "evidencePolicy": {
    "privateEvidenceStoredInRepository": false,
    "referencePattern": "^[A-Z0-9][A-Z0-9._/-]{2,79}$",
    "notes": "Store only opaque references here. Consent forms, identity records, signed approvals and source documents remain in the school's controlled system."
  },
  "checkProfiles": {
    "campus-media": [
      "accuracy",
      "rights",
      "privacy",
      "management-approval"
    ],
    "pupil-media": [
      "accuracy",
      "rights",
      "guardian-consent",
      "privacy",
      "institutional-status",
      "management-approval"
    ],
    "derived-media": [
      "accuracy",
      "rights",
      "source-assets",
      "management-approval"
    ],
    "institutional-claim": [
      "accuracy",
      "authoritative-source",
      "institutional-status",
      "management-approval"
    ],
    "result-claim": [
      "accuracy",
      "authoritative-source",
      "guardian-consent",
      "privacy",
      "institutional-status",
      "management-approval"
    ],
    "public-document": [
      "authenticity",
      "metadata",
      "malware-scan",
      "privacy",
      "accessibility",
      "management-approval"
    ],
    "hero-campus-media": [
      "accuracy",
      "rights",
      "privacy",
      "management-approval"
    ]
  },
  "records": [
    {
      "id": "media-campus-main",
      "kind": "media",
      "title": "Main campus exterior",
      "sourcePointer": "public/media/home/campus-main.jpeg",
      "publicTargets": [
        "/",
        "/og.png"
      ],
      "checkProfile": "campus-media",
      "checks": {
        "accuracy": "pending",
        "rights": "pending",
        "privacy": "pending",
        "management-approval": "pending"
      },
      "decision": "review-required",
      "evidenceReferences": [],
      "approvedByRole": null,
      "approvedAt": null,
      "expiresAt": null,
      "notes": "Confirm source rights, location and that no identifiable person requires consent."
    },
    {
      "id": "media-campus-grounds",
      "kind": "media",
      "title": "Campus grounds exterior",
      "sourcePointer": "public/media/home/campus-grounds.jpeg",
      "publicTargets": [
        "/"
      ],
      "checkProfile": "campus-media",
      "checks": {
        "accuracy": "pending",
        "rights": "pending",
        "privacy": "pending",
        "management-approval": "pending"
      },
      "decision": "review-required",
      "evidenceReferences": [],
      "approvedByRole": null,
      "approvedAt": null,
      "expiresAt": null,
      "notes": "Confirm source rights, capture context and privacy review."
    },
    {
      "id": "media-campus-entrance",
      "kind": "media",
      "title": "Campus entrance exterior",
      "sourcePointer": "public/media/home/campus-entrance.jpeg",
      "publicTargets": [
        "/"
      ],
      "checkProfile": "campus-media",
      "checks": {
        "accuracy": "pending",
        "rights": "pending",
        "privacy": "pending",
        "management-approval": "pending"
      },
      "decision": "review-required",
      "evidenceReferences": [],
      "approvedByRole": null,
      "approvedAt": null,
      "expiresAt": null,
      "notes": "Review visible people, signage, contact details and source rights."
    },
    {
      "id": "media-campus-courtyard",
      "kind": "media",
      "title": "Campus perspective from grounds",
      "sourcePointer": "public/media/home/campus-courtyard.jpeg",
      "publicTargets": [
        "/"
      ],
      "checkProfile": "campus-media",
      "checks": {
        "accuracy": "pending",
        "rights": "pending",
        "privacy": "pending",
        "management-approval": "pending"
      },
      "decision": "review-required",
      "evidenceReferences": [],
      "approvedByRole": null,
      "approvedAt": null,
      "expiresAt": null,
      "notes": "Confirm source rights and whether the shaded image meets publication quality."
    },
    {
      "id": "media-class-x-results-2025-26",
      "kind": "media",
      "title": "Class X results artwork 2025-26",
      "sourcePointer": "public/media/home/class-x-results-2025-26.jpeg",
      "publicTargets": [
        "/"
      ],
      "checkProfile": "pupil-media",
      "checks": {
        "accuracy": "pending",
        "rights": "pending",
        "guardian-consent": "pending",
        "privacy": "pending",
        "institutional-status": "pending",
        "management-approval": "pending"
      },
      "decision": "blocked",
      "evidenceReferences": [],
      "approvedByRole": null,
      "approvedAt": null,
      "expiresAt": null,
      "notes": "Verify every name, portrait, mark, academic year and guardian consent."
    },
    {
      "id": "media-xii-science-2025-26",
      "kind": "media",
      "title": "XII Science results artwork 2025-26",
      "sourcePointer": "public/media/home/xii-science-2025-26.jpeg",
      "publicTargets": [
        "/"
      ],
      "checkProfile": "pupil-media",
      "checks": {
        "accuracy": "pending",
        "rights": "pending",
        "guardian-consent": "pending",
        "privacy": "pending",
        "institutional-status": "pending",
        "management-approval": "pending"
      },
      "decision": "blocked",
      "evidenceReferences": [],
      "approvedByRole": null,
      "approvedAt": null,
      "expiresAt": null,
      "notes": "Junior College status, results and guardian consent require explicit approval."
    },
    {
      "id": "media-rangotsav-2025-26",
      "kind": "media",
      "title": "Rangotsav award artwork 2025-26",
      "sourcePointer": "public/media/home/rangotsav-2025-26.jpeg",
      "publicTargets": [
        "/"
      ],
      "checkProfile": "pupil-media",
      "checks": {
        "accuracy": "pending",
        "rights": "pending",
        "guardian-consent": "pending",
        "privacy": "pending",
        "institutional-status": "pending",
        "management-approval": "pending"
      },
      "decision": "blocked",
      "evidenceReferences": [],
      "approvedByRole": null,
      "approvedAt": null,
      "expiresAt": null,
      "notes": "Verify recipients, award wording, classes, image rights and guardian consent."
    },
    {
      "id": "media-result-admissions-2025-26",
      "kind": "media",
      "title": "Results and admissions composite 2025-26",
      "sourcePointer": "public/media/home/result-and-admissions-2025-26.jpg",
      "publicTargets": [
        "/"
      ],
      "checkProfile": "pupil-media",
      "checks": {
        "accuracy": "pending",
        "rights": "pending",
        "guardian-consent": "pending",
        "privacy": "pending",
        "institutional-status": "pending",
        "management-approval": "pending"
      },
      "decision": "blocked",
      "evidenceReferences": [],
      "approvedByRole": null,
      "approvedAt": null,
      "expiresAt": null,
      "notes": "Verify pupil result, contact details, document checklist and engineering/medical claims."
    },
    {
      "id": "media-homepage-social-poster",
      "kind": "media",
      "title": "Homepage and social poster",
      "sourcePointer": "public/og.png",
      "publicTargets": [
        "/",
        "/og.png"
      ],
      "checkProfile": "derived-media",
      "checks": {
        "accuracy": "pending",
        "rights": "pending",
        "source-assets": "pending",
        "management-approval": "pending"
      },
      "decision": "review-required",
      "evidenceReferences": [],
      "approvedByRole": null,
      "approvedAt": null,
      "expiresAt": null,
      "notes": "Reapprove whenever copy, affiliation data or source photography changes."
    },
    {
      "id": "claim-school-name",
      "kind": "claim",
      "title": "Official school name",
      "sourcePointer": "app/data/site.ts#siteFacts.name",
      "publicTargets": [
        "/",
        "/school",
        "/school/academics",
        "/mandatory-public-disclosure"
      ],
      "checkProfile": "institutional-claim",
      "checks": {
        "accuracy": "verified",
        "authoritative-source": "verified",
        "institutional-status": "verified",
        "management-approval": "verified"
      },
      "decision": "approved",
      "evidenceReferences": [
        "EVD-2026-001"
      ],
      "approvedByRole": "school-management",
      "approvedAt": "2026-09-09T05:10:00.000Z",
      "expiresAt": null,
      "notes": "Record the controlling school document and management approval reference."
    },
    {
      "id": "claim-affiliation-number",
      "kind": "claim",
      "title": "CBSE affiliation number 1130851",
      "sourcePointer": "app/data/site.ts#siteFacts.affiliationNumber",
      "publicTargets": [
        "/",
        "/school/academics",
        "/mandatory-public-disclosure"
      ],
      "checkProfile": "institutional-claim",
      "checks": {
        "accuracy": "verified",
        "authoritative-source": "verified",
        "institutional-status": "verified",
        "management-approval": "verified"
      },
      "decision": "approved",
      "evidenceReferences": [
        "EVD-2026-001"
      ],
      "approvedByRole": "school-management",
      "approvedAt": "2026-09-09T05:10:00.000Z",
      "expiresAt": null,
      "notes": "Link the current CBSE source and school sign-off before release."
    },
    {
      "id": "claim-school-code",
      "kind": "claim",
      "title": "CBSE school code 30780",
      "sourcePointer": "app/data/disclosure.ts#generalInformation.school-code",
      "publicTargets": [
        "/school/academics",
        "/mandatory-public-disclosure"
      ],
      "checkProfile": "institutional-claim",
      "checks": {
        "accuracy": "verified",
        "authoritative-source": "verified",
        "institutional-status": "verified",